{
  "vehicleId": "na5-ix3",
  "status": "ready",
  "updatedAt": "2026-09-09",
  "sourceNoteKo": "오너들이 자주 묻는 내용을 뉴스·BMW 코리아 보도·상품 자료와 맞춰 정리해 두었어요. 커뮤니티 체감만 있는 항목은 그렇게 표시해요. 보조금·세금·혜택은 지역·출고일에 따라 다르니, 무공해차 통합누리집(ev.or.kr)과 딜러 견적으로 한 번 더 확인해 주세요.",
  "highlights": [
    "국고 보조금: iX3 50 xDrive 275만 원(2026-07 확정 보도). SE·M스포츠·프로 트림과 무관",
    "실제 수령은 국고+지자체. 지자체 예산·잔여 대수가 남아 있어야 함 → ev.or.kr에서 조회",
    "표시가 개소세 3.5% 기준 vs 7월 이후 5% 적용 구간이 있을 수 있음 — 견적서 세율 확인",
    "퍼스트 에디션은 한정·외장/휠 중심(약 30대). 프로 풀옵션과 동일하지 않음",
    "커뮤니티 체감(할인·소음·틴팅 등)은 참고용 — 공식 안내가 우선"
  ],
  "items": [
    {
      "id": "subsidy-basics",
      "category": "purchase",
      "titleKo": "전기차 보조금을 받을 수 있나",
      "questionKo": "트림마다 보조금이 다르나요? 어떻게 받나요?",
      "answerKo": "더 뉴 iX3 50 xDrive는 2026년 7월 기준 국고 보조금 275만 원이 책정됐습니다(BMW그룹코리아·다수 언론). 동일 파워트레인(50 xDrive)이면 SE·M 스포츠·M 스포츠 프로 등 트림과 관계없이 국고 대상입니다. 여기에 거주 지자체 보조금이 더해지며, 지자체 예산·잔여 물량이 소진되면 국고만 있거나 지원을 못 받을 수 있습니다. 금액·잔여는 무공해차 통합누리집(ev.or.kr) ‘지자체 차종별 보조금·지급현황’에서 확인하세요. 지급은 보통 출고·등록 과정에서 반영되며, ‘잔금 후 페이백’만으로 일반화하기 어렵습니다.",
      "confidence": "confirmed",
      "tags": [
        "보조금",
        "국고",
        "지자체"
      ],
      "asOf": "2026-09",
      "caveatKo": "출처 예: 매일경제·ZDNet·뉴스투데이 2026-07-14(국고 275만). 지자체 지방비·잔여는 지역·시점에 따라 다름."
    },
    {
      "id": "subsidy-vs-tax",
      "category": "purchase",
      "titleKo": "보조금 vs 개소세·취득세",
      "questionKo": "보조금을 기다리느라 출고를 미루면 이득인가요?",
      "answerKo": "보조금(국고+지방)과 개별소비세·취득세 감면은 별개 제도입니다. 출고를 미루면 지자체 잔여가 남아 보조금을 받을 수도 있지만, 세율·감면 조건이 바뀌면 세금 부담이 커질 수 있습니다. 보도·견적상 초기 표시가가 개소세 3.5% 기준인 경우가 있고, 이후 기본세율 5% 구간 출고 시 계약가가 달라질 수 있다는 안내가 있습니다. ‘미루면 무조건 이득’이 아니라, 예상 보조금과 세금 차이를 숫자로 비교하세요.",
      "confidence": "confirmed",
      "tags": [
        "보조금",
        "개소세"
      ],
      "asOf": "2026-09",
      "caveatKo": "세금·감면 연장은 법령·공고에 따름. 딜러 견적서의 세율 기준을 확인할 것."
    },
    {
      "id": "price-tax-basis",
      "category": "purchase",
      "titleKo": "표시 가격과 개소세 3.5% / 5%",
      "questionKo": "예약·홈페이지 가격이 개소세 몇 % 기준인가요?",
      "answerKo": "BMW 코리아 출시 보도·사양 안내는 부가세 포함·개별소비세 3.5% 적용 기준으로 SE 7,990만 / M스포츠 8,690~8,710만 / 프로 9,190만 원을 제시했습니다. 이후 법정 세율이 5%로 적용되는 출고 구간이면 동일 트림이라도 견적 금액이 달라질 수 있습니다. 계약서·견적서에 적힌 세율·적용일을 확인하세요.",
      "confidence": "confirmed",
      "tags": [
        "가격",
        "개소세"
      ],
      "asOf": "2026-09",
      "caveatKo": "출처: BMW 코리아 2026-06-18 출시 보도. 실제 결제가는 출고일·옵션·보조금에 따라 변동."
    },
    {
      "id": "first-edition",
      "category": "trim",
      "titleKo": "퍼스트 에디션은 뭐가 다른가",
      "questionKo": "퍼스트 에디션은 프로 옵션이 다 들어가나요?",
      "answerKo": "공식·상품자료상 ‘M 스포츠 퍼스트 에디션’은 사전예약 고객 대상 한정(약 30대)으로, 전용 외장(프로즌/스페이스 실버 등)과 22인치 휠·인디비주얼 스티어링 등이 차별점입니다. M 스포츠 프로의 파킹 어시스턴트 프로페셔널·메리노 풀세트 등을 모두 포함한 상위 트림 대체재로 보기는 어렵습니다.",
      "confidence": "confirmed",
      "tags": [
        "퍼스트에디션"
      ],
      "asOf": "2026-09",
      "caveatKo": "출처: BMW 코리아 출시·예약 보도, 상품 정보 PDF 요약. 판매 종료·재고는 딜러 확인."
    },
    {
      "id": "trim-msport-vs-pro",
      "category": "trim",
      "titleKo": "M 스포츠 vs M 스포츠 프로",
      "questionKo": "휠 때문에 프로로 가야 할까요?",
      "answerKo": "상품자료 기준 차별점은 대략 다음과 같습니다. M스포츠: 21인치·블루 M브레이크·파노라마·3D HUD·하만카돈·파킹 플러스 등. 프로: 22인치·레드 브레이크·쉐도우라인·인디비주얼 레더·M휠/벨트·파킹 프로페셔널 등. 큰 휠은 디자인에 유리하고 승차감·전비·타이어비에는 불리할 수 있다는 체감이 많습니다(커뮤니티). 원격주차가 필요하면 프로 선택 또는 출고 후 디지털 업그레이드를 검토하세요.",
      "confidence": "confirmed",
      "tags": [
        "트림",
        "휠",
        "파킹"
      ],
      "asOf": "2026-09",
      "caveatKo": "장비 표는 상품·사양표 기준. 승차감 평가는 community 체감."
    },
    {
      "id": "parking-upgrade",
      "category": "software",
      "titleKo": "파킹 어시스턴트 프로 업그레이드",
      "questionKo": "M 스포츠(플러스)에서 원격주차(프로)로 올릴 수 있나요?",
      "answerKo": "상품자료상 파킹 어시스턴트 프로페셔널이 없는 모델은 ConnectedDrive 스토어에서 구매·구독 가능하다는 안내가 있습니다. 오너 커뮤니티에서는 평생 구독 약 41만~42만 원대 언급이 있으나, 공식 고정가가 확인된 것은 아니므로 출고 후 앱·스토어·딜러에서 확인하세요.",
      "confidence": "community",
      "tags": [
        "파킹",
        "구독"
      ],
      "asOf": "2026-09",
      "caveatKo": "가능 여부는 공식(스토어 안내)에 가깝고, 금액은 커뮤니티 언급 — 변동 가능."
    },
    {
      "id": "delivery-timing",
      "category": "delivery",
      "titleKo": "배정·인도 일정",
      "questionKo": "언제 배정되고 언제 타나요?",
      "answerKo": "공식 일정은 딜러·예약 순번·생산 물량에 따라 달라 고정값이 없습니다. 출시 초기 오픈채팅에서는 7월대 초도 인도·이후 대기 등 체감이 공유됐으나, 이는 당시 상황입니다. 현재 대기열은 담당 딜러의 배정·입항 안내를 따르세요.",
      "confidence": "community",
      "tags": [
        "배정",
        "출고"
      ],
      "asOf": "2026-09",
      "caveatKo": "과거 커뮤니티 일정은 참고만. 공식 약속이 아님."
    },
    {
      "id": "discount-promo",
      "category": "finance",
      "titleKo": "할인·프로모션",
      "questionKo": "출고 초에도 할인이 있나요?",
      "answerKo": "제조사 공식 MSRP와 별도로, 딜러·결제수단·재구매·트레이드인·금융 상품에 따른 조건부 혜택이 있을 수 있습니다. 초기에는 큰 할인이 적다는 체감과, 딜러별 소액·카드 할인이 있다는 사례가 혼재합니다. 여러 딜러 견적을 비교하는 것이 현실적입니다.",
      "confidence": "community",
      "tags": [
        "할인",
        "딜러"
      ],
      "asOf": "2026-09"
    },
    {
      "id": "fullcare",
      "category": "finance",
      "titleKo": "뉴 풀케어 프로그램",
      "questionKo": "파이낸셜 받으면 풀케어가 좋은가요?",
      "answerKo": "사전예약·금융 이용 시 ‘뉴 풀케어’ 등이 혜택으로 안내된 바 있습니다(출시·예약 보도). 커뮤니티에서는 문콕·스크래치가 제휴 복원 업체 수리, 휠·타이어는 주행거리·기간 제한이 있어 체감이 갈린다는 평가가 많습니다. 약관의 한도·횟수·제외 항목을 읽고, 금리 조건과 함께 판단하세요.",
      "confidence": "community",
      "tags": [
        "풀케어",
        "금융"
      ],
      "asOf": "2026-09",
      "caveatKo": "혜택 존재는 보도·계약 안내 확인. 체감 평가는 community."
    },
    {
      "id": "wallbox-chargecard",
      "category": "charging",
      "titleKo": "충전 카드·월박스 혜택",
      "questionKo": "월박스 설치와 충전비 100만 원 중 고르나요?",
      "answerKo": "사전예약 후 당해 연도 출고 고객에게 100만 원 상당 충전 카드 등이 안내된 보도가 있습니다. 월박스(가정용 충전기) 설치를 그와 1:1로 고르는 구조인지는 계약·론칭 혜택 문구마다 다를 수 있어, ‘둘 중 하나’로 단정하지 말고 딜러·계약서를 확인하세요.",
      "confidence": "confirmed",
      "tags": [
        "충전",
        "사전예약"
      ],
      "asOf": "2026-09",
      "caveatKo": "충전카드 안내: BMW 코리아 사전예약·출시 관련 보도. 월박스 조건은 딜러 확인."
    },
    {
      "id": "v2l",
      "category": "charging",
      "titleKo": "V2L(양방향·외부 전원)",
      "questionKo": "V2L이 기본인가요? 케이블이 있나요?",
      "answerKo": "차량은 양방향 충전·V2L 대응으로 보도·상품자료에 소개됩니다. V2L 어댑터 등 액세서리는 별도 구매라는 상품자료 안내가 있으며, 인도 차량에 케이블이 기본 포함되지 않았다는 오너 언급도 있습니다. 사제 제품은 보증·안전 이슈가 있을 수 있어 공식 액세서리를 확인하세요.",
      "confidence": "confirmed",
      "tags": [
        "V2L"
      ],
      "asOf": "2026-09",
      "caveatKo": "기능 존재·별도 액세서리: 상품자료·보도. 포함 여부는 출고 사양 확인."
    },
    {
      "id": "glass-roof-heat",
      "category": "ownership",
      "titleKo": "글라스 루프 열기·썬쉐이드",
      "questionKo": "파노라마 루프가 많이 뜨거운가요?",
      "answerKo": "클라이밋 컴포트 글래징(직사광선·열·UV 저감)이 SE 제외 트림에 적용됩니다(상품자료). 시승·오너 체감으로는 ‘의외로 덜 뜨겁다’는 의견이 많습니다. 가리고 싶으면 유럽몰 NA5 전용 루프 차양(예: 품번 51465B72889) 또는 국내 썬쉐이드 호가(커뮤니티 40만 원대 언급)를 참고하세요.",
      "confidence": "community",
      "tags": [
        "루프",
        "썬쉐이드"
      ],
      "asOf": "2026-09",
      "caveatKo": "글래징 사양은 상품자료. 열감·국내 호가는 community."
    },
    {
      "id": "kr-accessory-prices",
      "category": "accessory",
      "titleKo": "국내에서 거론된 순정 액세서리 가격 예",
      "questionKo": "바닥매트·트렁크매트·썬쉐이드 얼마인가요?",
      "answerKo": "오픈채팅에 공유된 예시(공식 고시가 아님): 1열 매트 약 14.6만, 2열 약 12.4만, 트렁크 매트 약 27.8만, 썬쉐이드 약 41.9만 원. 유럽 공식몰 € 표시가와 비교해 보면 참고가 됩니다. 실제 견적은 딜러·조이몰 등에서 확인하세요.",
      "confidence": "community",
      "tags": [
        "매트",
        "가격"
      ],
      "asOf": "2026-09",
      "caveatKo": "커뮤니티 공유가. 재고·할인과 다를 수 있음."
    },
    {
      "id": "digital-key",
      "category": "software",
      "titleKo": "디지털 키·카드 키",
      "questionKo": "실물 키 없이 폰만 다니면 되나요? 키는 몇 대까지?",
      "answerKo": "상품자료상 디지털 키 플러스가 적용되며, 공유 가능 기기 수(자료상 최대 18대 언급)·셋업 카드·실물 키 구성이 안내됩니다. 실사용에서는 배우자 폰 등록·월렛·차내 카드 키 보관 등 설정 이슈가 커뮤니티에 자주 올라옵니다. 분실·잠금 로직에 대비해 여분 키 운용을 권합니다.",
      "confidence": "confirmed",
      "tags": [
        "디지털키"
      ],
      "asOf": "2026-09",
      "caveatKo": "기능·대수: 상품자료. 등록 트러블슈팅은 community."
    },
    {
      "id": "wireless-charge-carplay",
      "category": "software",
      "titleKo": "무선 충전·스마트폰 연동",
      "questionKo": "무선 충전·카플레이는 어떤가요?",
      "answerKo": "시승·초기 오너 기준으로 무선 충전 성능·좌우 패드 동작에 대한 아쉬움이 공유된 바 있습니다. 인포테인먼트는 OS X·파노라믹 iDrive·T맵 기반 내비 등이 강조됩니다. 본인 폰 생태계에 맞춰 시승 때 직접 확인하는 것이 좋습니다.",
      "confidence": "community",
      "tags": [
        "무선충전",
        "연동"
      ],
      "asOf": "2026-09"
    },
    {
      "id": "tint-ppf",
      "category": "ownership",
      "titleKo": "틴팅·PPF",
      "questionKo": "출고 직후 무엇을 먼저 하나요?",
      "answerKo": "출고 직후 시공에 대한 공식 필수는 없습니다. 오너 사이에서는 틴팅이 거의 공통이고, 전체 PPF는 비용·재시공 부담으로 호불호가 갈립니다. 딜러 기본 제공 시공 수준을 보고 추가 여부를 정하는 경우가 많습니다.",
      "confidence": "community",
      "tags": [
        "틴팅",
        "PPF"
      ],
      "asOf": "2026-09"
    },
    {
      "id": "cargo-space",
      "category": "ownership",
      "titleKo": "트렁크·프렁크 체감",
      "questionKo": "짐은 충분한가요?",
      "answerKo": "공식 제원: 트렁크 520–1,750L, 프렁크(프론트 컴파트먼트) 약 58L. 일부 오너는 ‘생각보다 작다’·특정 골프백 이슈를 언급합니다. 큰 짐이 많으면 실차 적재로 확인하세요.",
      "confidence": "confirmed",
      "tags": [
        "트렁크"
      ],
      "asOf": "2026-09",
      "caveatKo": "리터 수치는 상품자료. 체감은 community."
    },
    {
      "id": "nvh",
      "category": "ownership",
      "titleKo": "소음(풍절음·노면음)",
      "questionKo": "고속에서 시끄러운가요?",
      "answerKo": "정량 공식 비교치는 사이트에 없습니다. 오너·시승 체감은 ‘경쟁 대비 조용’과 ‘노면음·고속 풍절음이 느껴짐’이 공존합니다. 휠 인치·노면·속도에 따라 달라지므로 시승으로 판단하세요.",
      "confidence": "community",
      "tags": [
        "소음"
      ],
      "asOf": "2026-09"
    }
  ]
}
